{"_metadata": {"version": "2.0", "description": "\u6e38\u620f\u89c4\u5219\u5b9a\u4e49\uff08\u53ef\u6267\u884c\u6761\u4ef6\u6811\uff09"}, "win_conditions": {"checkmate": {"enabled": true, "display_name": "\u5c06\u6b7b\u5bf9\u65b9", "icon": "\u265a", "description": "\u4f7f\u5bf9\u65b9\u5c06\u5e05\u65e0\u8def\u53ef\u8d70\u4e14\u5904\u4e8e\u88ab\u5c06\u519b\u72b6\u6001", "priority": 1, "category": "victory"}, "general_captured": {"enabled": true, "display_name": "\u5403\u6389\u5bf9\u65b9\u5c06\u5e05", "icon": "\u2694\ufe0f", "description": "\u76f4\u63a5\u5403\u6389\u5bf9\u65b9\u7684\u5c06\u6216\u5e05", "priority": 2, "category": "victory"}, "stalemate": {"enabled": true, "display_name": "\u56f0\u6bd9\u5bf9\u65b9", "icon": "\ud83d\ude36", "description": "\u5bf9\u65b9\u65e0\u5b50\u53ef\u52a8\u4e14\u672a\u88ab\u5c06\u519b", "result": "win", "priority": 3, "category": "victory"}}, "special_rules": {"flying_general": {"enabled": true, "description": "\u53cc\u65b9\u5c06\u5e05\u4e0d\u80fd\u5728\u540c\u4e00\u7ad6\u7ebf\u4e0a\u65e0\u906e\u6321\u76f8\u5bf9"}}, "turn_rules": {"turn_order": "alternating", "first_player": "red"}, "ai_difficulty": {"current": "medium", "levels": {"easy": {"depth": 2, "randomness": 0.3}, "medium": {"depth": 3, "randomness": 0.1}, "hard": {"depth": 4, "randomness": 0.0}}, "personality": {"type": "normal", "aggressiveness": 0.5, "conservatism": 0.5, "randomness_override": null, "depth_override": null, "value_biases": {}, "custom_prompt": null}}}