{"_metadata": {"version": "1.0", "description": "\u56f4\u68cb\u6e38\u620f\u89c4\u5219\u5b9a\u4e49"}, "win_conditions": {"capture_10": {"enabled": true, "display_name": "\u5403\u5341\u5b50\u83b7\u80dc", "icon": "\ud83c\udfaf", "description": "\u7387\u5148\u5403\u6389\u5bf9\u65b9\u5341\u4e2a\u5b50\u7684\u4e00\u65b9\u83b7\u80dc", "target": 10, "priority": 1, "category": "victory"}, "capture_all": {"enabled": true, "display_name": "\u5168\u6b7c\u5bf9\u65b9", "icon": "\ud83d\udc80", "description": "\u5403\u6389\u5bf9\u65b9\u6240\u6709\u68cb\u5b50", "priority": 2, "category": "victory"}, "resign": {"enabled": true, "display_name": "\u8ba4\u8f93", "icon": "\ud83c\udff3\ufe0f", "description": "\u4e00\u65b9\u4e3b\u52a8\u8ba4\u8f93", "priority": 3, "category": "victory"}}, "special_rules": {"ko_rule": {"enabled": true, "description": "\u6253\u52ab\u89c4\u5219\uff1a\u7981\u6b62\u7acb\u5373\u63d0\u56de\u521a\u521a\u88ab\u63d0\u8d70\u7684\u5b50"}, "suicide_rule": {"enabled": true, "description": "\u81ea\u6740\u89c4\u5219\uff1a\u7981\u6b62\u843d\u5b50\u540e\u81ea\u8eab\u65e0\u6c14"}, "forbidden_black": {"enabled": false, "description": "\u9ed1\u68cb\u7981\u624b\uff1a\u7981\u6b62\u4e09\u4e09\u3001\u56db\u56db\u3001\u957f\u8fde"}}, "turn_rules": {"turn_order": "alternating", "first_player": "black"}, "ai_difficulty": {"current": "medium", "levels": {"easy": {"depth": 2, "randomness": 0.3}, "medium": {"depth": 3, "randomness": 0.1}, "hard": {"depth": 4, "randomness": 0.0}}, "personality": {"type": "normal", "aggressiveness": 0.5, "conservatism": 0.5, "randomness_override": null, "depth_override": null, "value_biases": {}, "custom_prompt": null}}}